<?xml version="1.0" encoding="UTF-8"?>
<!DOCTYPE Books SYSTEM "dtd/5_Books.dtd">
<Books>
    <Book title="XML">
        <author>Author Name 1</author>
        <year>2024</year>
        <publisher>Publisher Name 1</publisher>
    </Book>
    <Book title="DCN">
        <author>Author Name 2</author>
        <year>2023</year>
        <publisher>Publisher Name 2</publisher>
    </Book>
</Books>